[
  {
    "id": "clean_001",
    "doc_id": "cuad_limeenergyco-09-09-1999-ex-10-distributor-agreement",
    "source": "cuad",
    "contract_type": "unknown",
    "category": "clean",
    "objective": "Locate and extract the \"Governing Law\" clause.",
    "expected_fields": [
      {
        "name": "Governing Law",
        "value": "This Agreement is to be construed according to the laws          of the State of Illinois."
      }
    ],
    "expected_flags": [
      {
        "playbook_id": "governing_law",
        "severity": "low"
      }
    ],
    "gold_spans": [
      {
        "doc_id": "cuad_limeenergyco-09-09-1999-ex-10-distributor-agreement",
        "char_start": 52061,
        "char_end": 52151,
        "quote": "This Agreement is to be construed according to the laws          of the State of Illinois."
      }
    ],
    "grader": "span_match",
    "notes": "CUAD governing-law span; tests clause localization against loaded corpus"
  },
  {
    "id": "clean_002",
    "doc_id": "cuad_whitesmoke-inc-11-08-2011-ex-10-26-promotion-and-distribution-agreement",
    "source": "cuad",
    "contract_type": "unknown",
    "category": "clean",
    "objective": "Locate and extract the \"Governing Law\" clause.",
    "expected_fields": [
      {
        "name": "Governing Law",
        "value": "This Agreement is governed by English law and the parties submit to the exclusive jurisdiction of the English courts in  relation to any dispute (contractual or non-contractual) concerning this Agreement save that either party may apply to any court for an  injunction or other relief to protect its Intellectual Property Rights."
      }
    ],
    "expected_flags": [
      {
        "playbook_id": "governing_law",
        "severity": "low"
      }
    ],
    "gold_spans": [
      {
        "doc_id": "cuad_whitesmoke-inc-11-08-2011-ex-10-26-promotion-and-distribution-agreement",
        "char_start": 41315,
        "char_end": 41644,
        "quote": "This Agreement is governed by English law and the parties submit to the exclusive jurisdiction of the English courts in  relation to any dispute (contractual or non-contractual) concerning this Agreement save that either party may apply to any court for an  injunction or other relief to protect its Intellectual Property Rights."
      }
    ],
    "grader": "span_match",
    "notes": "CUAD governing-law span; tests clause localization against loaded corpus"
  },
  {
    "id": "clean_003",
    "doc_id": "cuad_lohacompanyltd-20191209-f-1-ex-10-16-11917878-ex-10-16-supply-agreement",
    "source": "cuad",
    "contract_type": "unknown",
    "category": "clean",
    "objective": "Locate and extract the \"Governing Law\" clause.",
    "expected_fields": [
      {
        "name": "Governing Law",
        "value": "It will be governed by the law of the People's Republic of China ,otherwise it is governed by United Nations Convention on Contract for the International Sale of Goods."
      }
    ],
    "expected_flags": [
      {
        "playbook_id": "governing_law",
        "severity": "low"
      }
    ],
    "gold_spans": [
      {
        "doc_id": "cuad_lohacompanyltd-20191209-f-1-ex-10-16-11917878-ex-10-16-supply-agreement",
        "char_start": 10691,
        "char_end": 10859,
        "quote": "It will be governed by the law of the People's Republic of China ,otherwise it is governed by United Nations Convention on Contract for the International Sale of Goods."
      }
    ],
    "grader": "span_match",
    "notes": "CUAD governing-law span; tests clause localization against loaded corpus"
  },
  {
    "id": "clean_004",
    "doc_id": "cuad_centrackinternationalinc-10-29-1999-ex-10-3-web-site-hosting-agreement",
    "source": "cuad",
    "contract_type": "unknown",
    "category": "clean",
    "objective": "Locate and extract the \"Governing Law\" clause.",
    "expected_fields": [
      {
        "name": "Governing Law",
        "value": "This Agreement was entered into in the State of Florida, and its validity, construction, interpretation, and legal effect shall be governed by the laws and judicial decisions of the State of Florida applicable to contracts entered into and performed entirely within the State of Florida."
      }
    ],
    "expected_flags": [
      {
        "playbook_id": "governing_law",
        "severity": "low"
      }
    ],
    "gold_spans": [
      {
        "doc_id": "cuad_centrackinternationalinc-10-29-1999-ex-10-3-web-site-hosting-agreement",
        "char_start": 14093,
        "char_end": 14380,
        "quote": "This Agreement was entered into in the State of Florida, and its validity, construction, interpretation, and legal effect shall be governed by the laws and judicial decisions of the State of Florida applicable to contracts entered into and performed entirely within the State of Florida."
      }
    ],
    "grader": "span_match",
    "notes": "CUAD governing-law span; tests clause localization against loaded corpus"
  },
  {
    "id": "clean_005",
    "doc_id": "cuad_adamsgolfinc-03-21-2005-ex-10-17-endorsement-agreement",
    "source": "cuad",
    "contract_type": "unknown",
    "category": "clean",
    "objective": "Locate and extract the \"Governing Law\" clause.",
    "expected_fields": [
      {
        "name": "Governing Law",
        "value": "This Agreement shall be governed and construed according to the laws of the State of Kansas."
      }
    ],
    "expected_flags": [
      {
        "playbook_id": "governing_law",
        "severity": "low"
      }
    ],
    "gold_spans": [
      {
        "doc_id": "cuad_adamsgolfinc-03-21-2005-ex-10-17-endorsement-agreement",
        "char_start": 19173,
        "char_end": 19265,
        "quote": "This Agreement shall be governed and construed according to the laws of the State of Kansas."
      }
    ],
    "grader": "span_match",
    "notes": "CUAD governing-law span; tests clause localization against loaded corpus"
  },
  {
    "id": "clean_006",
    "doc_id": "cuad_kiromicbiopharma-inc-05-11-2020-ex-10-23-consulting-agreement",
    "source": "cuad",
    "contract_type": "unknown",
    "category": "clean",
    "objective": "Locate and extract the \"Governing Law\" clause.",
    "expected_fields": [
      {
        "name": "Governing Law",
        "value": "This Agreement shall be governed by the laws of the State of Texas, without reference to its conflicts of law principles."
      }
    ],
    "expected_flags": [
      {
        "playbook_id": "governing_law",
        "severity": "low"
      }
    ],
    "gold_spans": [
      {
        "doc_id": "cuad_kiromicbiopharma-inc-05-11-2020-ex-10-23-consulting-agreement",
        "char_start": 12387,
        "char_end": 12508,
        "quote": "This Agreement shall be governed by the laws of the State of Texas, without reference to its conflicts of law principles."
      }
    ],
    "grader": "span_match",
    "notes": "CUAD governing-law span; tests clause localization against loaded corpus"
  },
  {
    "id": "clean_007",
    "doc_id": "cuad_veoneer-inc-02-21-2020-ex-10-11-joint-venture-agreement",
    "source": "cuad",
    "contract_type": "unknown",
    "category": "clean",
    "objective": "Locate and extract the \"Governing Law\" clause.",
    "expected_fields": [
      {
        "name": "Governing Law",
        "value": "This Amendment shall be governed by and construed in accordance with the laws of Japan."
      }
    ],
    "expected_flags": [
      {
        "playbook_id": "governing_law",
        "severity": "low"
      }
    ],
    "gold_spans": [
      {
        "doc_id": "cuad_veoneer-inc-02-21-2020-ex-10-11-joint-venture-agreement",
        "char_start": 6650,
        "char_end": 6737,
        "quote": "This Amendment shall be governed by and construed in accordance with the laws of Japan."
      }
    ],
    "grader": "span_match",
    "notes": "CUAD governing-law span; tests clause localization against loaded corpus"
  },
  {
    "id": "clean_008",
    "doc_id": "cuad_dovapharmaceuticalsinc-20181108-10-q-ex-10-2-11414857-ex-10-2-promotion-agreement",
    "source": "cuad",
    "contract_type": "unknown",
    "category": "clean",
    "objective": "Locate and extract the \"Expiration Date\" clause.",
    "expected_fields": [
      {
        "name": "Expiration Date",
        "value": "This Agreement shall become effective as of the Effective Date and, unless earlier terminated as provided in this ARTICLE 12, shall extend until the four (4) year anniversary of the Effective Date (the \"Term\")."
      }
    ],
    "expected_flags": [],
    "gold_spans": [
      {
        "doc_id": "cuad_dovapharmaceuticalsinc-20181108-10-q-ex-10-2-11414857-ex-10-2-promotion-agreement",
        "char_start": 137974,
        "char_end": 138184,
        "quote": "This Agreement shall become effective as of the Effective Date and, unless earlier terminated as provided in this ARTICLE 12, shall extend until the four (4) year anniversary of the Effective Date (the \"Term\")."
      }
    ],
    "grader": "span_match",
    "notes": "CUAD expiration-date span; tests contract term extraction"
  },
  {
    "id": "clean_009",
    "doc_id": "cuad_pacira-pharmaceuticals-inc-a-r-strategic-licensing-distribution-and-marketing-agreement",
    "source": "cuad",
    "contract_type": "unknown",
    "category": "clean",
    "objective": "Locate and extract the \"Expiration Date\" clause.",
    "expected_fields": [
      {
        "name": "Expiration Date",
        "value": "This Agreement shall commence on the Effective Date and, subject to earlier termination in accordance with the provisions of Section 16, shall continue in force for a period being the longer of fifteen (15) years from first Commercial Launch of the Product in the Territory or until  the expiration of the last valid claim in the PPI Patents covering the Product in any country of the Territory (the \"Initial Term\")."
      }
    ],
    "expected_flags": [],
    "gold_spans": [
      {